{
  "meta": {
    "schema_version": "2",
    "submitted_at": "2026-06-22T09:15:00+10:00"
  },
  "units": "km",
  "runner": {
    "name": "Alex Smith",
    "experience": "experienced"
  },
  "goal": {
    "race": "Melbourne Marathon",
    "distance": "marathon",
    "date": "2026-10-18",
    "target_time": "3:59:00",
    "start_date": "2026-06-30"
  },
  "recent_result": {
    "distance": "5k",
    "time": "22:10",
    "date": "2026-06-07"
  },
  "current_fitness": {
    "weekly_distance": 40,
    "longest_run": 18,
    "recent_peak_weekly": 50,
    "vdot": 44.15
  },
  "weekly_schedule": {
    "availability": {
      "Tuesday": {"morning": false},
      "Thursday": {"morning": false}
    },
    "preferred_sessions": [
      {"day": "Sunday", "type": "long"},
      {"day": "Tuesday", "type": "quality", "description": "intervals with running club"},
      {"day": "Saturday", "type": "quality", "description": "parkrun", "distance_min": 5, "time_of_day": "morning"},
      {"day": "Wednesday", "type": "strength", "description": "gym weights and core", "distance_max": 0},
      {"day": "Friday", "type": "strength", "description": "gym weights and core", "distance_max": 0}
    ]
  },
  "b_races": [
    {
      "name": "Ballarat Half Marathon",
      "distance": "half",
      "date": "2026-08-30",
      "target_time": "1:47:00"
    }
  ],
  "other_events": [
    {
      "date": "2026-08-16",
      "type": "easy",
      "description": "Bridge to Brisbane",
      "distance_min": 10,
      "distance_max": 10
    }
  ],
  "notes": {
    "other": ""
  }
}
